{
  "$schema": "https://json-schema.org/draft/2020-12/schema",
  "$defs": {
    "id": {
      "type": "string",
      "pattern": "^[a-z0-9][a-z0-9-]*$",
      "minLength": 3
    },
    "sourceIds": {
      "type": "array",
      "items": {
        "type": "string",
        "minLength": 3
      },
      "minItems": 1,
      "uniqueItems": true
    },
    "contentStatus": {
      "enum": [
        "planned",
        "draft",
        "machine-assisted",
        "human-reviewed",
        "production-ready",
        "fixture"
      ]
    },
    "translationReviewStatus": {
      "enum": [
        "draft",
        "machine-assisted",
        "human-reviewed"
      ]
    },
    "ref": {
      "type": "object",
      "required": [
        "id",
        "path"
      ],
      "properties": {
        "id": {
          "$ref": "#/$defs/id"
        },
        "path": {
          "type": "string",
          "minLength": 3
        }
      },
      "additionalProperties": false
    },
    "reviewMetadata": {
      "type": "object",
      "required": [
        "reviewStage",
        "reviewReason"
      ],
      "properties": {
        "firstIntroducedIn": {
          "type": [
            "string",
            "null"
          ]
        },
        "reviewStage": {
          "type": "integer",
          "minimum": 1
        },
        "reviewReason": {
          "type": "string",
          "minLength": 3
        },
        "previousExerciseId": {
          "type": [
            "string",
            "null"
          ]
        }
      },
      "additionalProperties": false
    }
  },
  "title": "HSK unit",
  "type": "object",
  "required": [
    "recordType",
    "id",
    "syllabusVersion",
    "level",
    "order",
    "topic",
    "titleZh",
    "titleVi",
    "objectives",
    "prerequisiteUnitIds",
    "lessonRefs",
    "checkpointRef",
    "sourceIds",
    "contentStatus",
    "contentVersion"
  ],
  "properties": {
    "recordType": {
      "const": "unit"
    },
    "id": {
      "$ref": "#/$defs/id"
    },
    "syllabusVersion": {
      "type": "string",
      "minLength": 3
    },
    "level": {
      "type": "integer",
      "minimum": 1,
      "maximum": 9
    },
    "order": {
      "type": "integer",
      "minimum": 1
    },
    "topic": {
      "type": "string",
      "minLength": 1
    },
    "titleZh": {
      "type": "string",
      "minLength": 1
    },
    "titleVi": {
      "type": "string",
      "minLength": 1
    },
    "objectives": {
      "type": "array",
      "items": {
        "type": "string",
        "minLength": 1
      },
      "minItems": 1
    },
    "prerequisiteUnitIds": {
      "type": "array",
      "items": {
        "$ref": "#/$defs/id"
      },
      "uniqueItems": true
    },
    "prerequisiteLevelId": {
      "type": [
        "string",
        "null"
      ]
    },
    "lessonRefs": {
      "type": "array",
      "minItems": 1,
      "items": {
        "type": "object",
        "required": [
          "id",
          "path",
          "order"
        ],
        "properties": {
          "id": {
            "$ref": "#/$defs/id"
          },
          "path": {
            "type": "string",
            "minLength": 3
          },
          "order": {
            "type": "integer",
            "minimum": 1
          }
        },
        "additionalProperties": false
      }
    },
    "checkpointRef": {
      "$ref": "#/$defs/ref"
    },
    "sourceIds": {
      "$ref": "#/$defs/sourceIds"
    },
    "contentStatus": {
      "$ref": "#/$defs/contentStatus"
    },
    "contentVersion": {
      "type": "integer",
      "minimum": 1
    }
  },
  "additionalProperties": false
}
