{"recordType":"unit","id":"hsk1-fixture-u01","syllabusVersion":"GF0025-2021","level":1,"order":1,"topic":"greeting-and-identity","titleZh":"你好，我叫安","titleVi":"Xin chào, tôi tên An","objectives":["Chào hỏi lịch sự","Giới thiệu tên","Hỏi và trả lời danh tính cơ bản"],"prerequisiteUnitIds":[],"lessonRefs":[{"id":"hsk1-fixture-u01-l01","path":"../lessons/hsk1-fixture-u01-l01.json","order":1},{"id":"hsk1-fixture-u01-l02","path":"../lessons/hsk1-fixture-u01-l02.json","order":2}],"checkpointRef":{"id":"hsk1-fixture-u01-checkpoint","path":"../assessments/hsk1-fixture-u01-checkpoint.json"},"sourceIds":["moe-gf0025-2021-standard","cti-hsk3-current-syllabus-2026"],"contentStatus":"fixture","contentVersion":1}